{
  "$schema": "https://json-schema.org/draft/2020-12/schema",
  "$id": "urn:railxia:asp:evidence-bundle:2",
  "title": "Evidence bundle, bundle_version 2 (DR-109: multiple agents in one sandbox)",
  "$comment": "Two rules are not expressible here and are checked in code instead: every attestation_ref names the id of an entry in attestations, and agents[].agent_key is sorted ascending, unique, and never 'default' (reserved for the unkeyed v1-compatible path). Unlike v1, this schema has no deployment_value def: v2 moves a shared 'deployment' fact into sandbox.attributes like any other attribute (EvidenceScope/EvidenceAgentScope carry no per-attribute shape restriction), so v1's closed-key-set-plus-byte-cap rule for it has no v2 counterpart yet, in schema or in code.",
  "type": "object",
  "required": [
    "bundle_version",
    "bundle_id",
    "host_id",
    "sandbox_name",
    "collected_at",
    "rule_pack_version",
    "sandbox",
    "agents"
  ],
  "additionalProperties": false,
  "properties": {
    "bundle_version": {
      "const": 2
    },
    "bundle_id": {
      "type": "string",
      "minLength": 1
    },
    "host_id": {
      "type": "string",
      "minLength": 1,
      "maxLength": 64,
      "pattern": "\\S"
    },
    "sandbox_name": {
      "type": "string",
      "minLength": 1,
      "maxLength": 255,
      "pattern": "\\S"
    },
    "collected_at": {
      "type": "string",
      "format": "date-time"
    },
    "rule_pack_version": {
      "type": "integer",
      "minimum": 1
    },
    "sandbox": {
      "type": "object",
      "required": ["inputs_attempted", "attributes"],
      "additionalProperties": false,
      "properties": {
        "inputs_attempted": {
          "$ref": "#/$defs/inputs_attempted"
        },
        "attributes": {
          "type": "object",
          "additionalProperties": {
            "$ref": "#/$defs/attribute"
          }
        }
      }
    },
    "agents": {
      "type": "array",
      "minItems": 1,
      "items": {
        "$ref": "#/$defs/agent_scope"
      }
    },
    "attestations": {
      "type": "array",
      "items": {
        "$ref": "#/$defs/attestation"
      }
    }
  },
  "$defs": {
    "agent_scope": {
      "type": "object",
      "required": ["agent_key", "discovery_status", "inputs_attempted", "attributes"],
      "additionalProperties": false,
      "properties": {
        "agent_key": {
          "type": "string",
          "pattern": "^[a-z0-9][a-z0-9._-]{0,63}$"
        },
        "discovery_status": {
          "enum": ["available", "not_found", "ambiguous"]
        },
        "inputs_attempted": {
          "$ref": "#/$defs/inputs_attempted"
        },
        "attributes": {
          "type": "object",
          "additionalProperties": {
            "$ref": "#/$defs/attribute"
          }
        }
      }
    },
    "inputs_attempted": {
      "type": "object",
      "required": [
        "runtime",
        "image",
        "manifest",
        "repo"
      ],
      "additionalProperties": false,
      "properties": {
        "runtime": {
          "$ref": "#/$defs/source"
        },
        "image": {
          "$ref": "#/$defs/non_runtime_source"
        },
        "manifest": {
          "$ref": "#/$defs/non_runtime_source"
        },
        "repo": {
          "$ref": "#/$defs/non_runtime_source"
        }
      }
    },
    "reason": {
      "enum": [
        "NO_SOURCE_ACCESS",
        "NOT_FIRST_PARTY",
        "SOURCE_OK_NOT_PRESENT",
        "UNKNOWN_HARNESS",
        "NOT_COLLECTED_BY_PACK",
        "PRIVATE_STORE",
        "CODE_CONSTRUCTED",
        "GATEWAY_MANAGED",
        "ORCHESTRATOR_MANAGED",
        "PROVIDER_HOSTED",
        "TEMPLATE_UNRESOLVED",
        "PARSE_FAILED",
        "SIZE_CAP_EXCEEDED",
        "MULTI_AGENT_SCOPE_UNRESOLVED"
      ]
    },
    "source": {
      "type": "object",
      "required": [
        "attempted"
      ],
      "additionalProperties": false,
      "properties": {
        "attempted": {
          "type": "boolean"
        },
        "reached": {
          "type": "boolean"
        },
        "reason": {
          "$ref": "#/$defs/reason"
        },
        "window_seconds": {
          "type": "integer",
          "minimum": 0
        }
      },
      "allOf": [
        {
          "if": {
            "properties": {
              "attempted": {
                "const": false
              }
            }
          },
          "then": {
            "required": [
              "reason"
            ]
          }
        },
        {
          "if": {
            "properties": {
              "attempted": {
                "const": true
              }
            }
          },
          "then": {
            "required": [
              "reached"
            ]
          }
        },
        {
          "if": {
            "required": [
              "reached"
            ],
            "properties": {
              "reached": {
                "const": false
              }
            }
          },
          "then": {
            "required": [
              "reason"
            ]
          }
        }
      ]
    },
    "non_runtime_source": {
      "allOf": [
        {
          "$ref": "#/$defs/source"
        },
        {
          "not": {
            "required": [
              "window_seconds"
            ]
          }
        }
      ]
    },
    "attestation": {
      "type": "object",
      "required": [
        "id",
        "root",
        "claim",
        "subject",
        "verified_at",
        "verifier_version"
      ],
      "additionalProperties": false,
      "properties": {
        "id": {
          "type": "string",
          "minLength": 1
        },
        "root": {
          "type": "string"
        },
        "claim": {
          "type": "string"
        },
        "subject": {
          "type": "string"
        },
        "verified_at": {
          "type": "string",
          "format": "date-time"
        },
        "verifier_version": {
          "type": "string"
        }
      }
    },
    "attribute": {
      "type": "object",
      "required": [
        "value",
        "status",
        "tier"
      ],
      "additionalProperties": false,
      "properties": {
        "value": true,
        "status": {
          "enum": [
            "ANSWERED",
            "ABSENT",
            "TEMPLATED",
            "PARTIAL",
            "BLIND",
            "FAILED"
          ]
        },
        "reason": {
          "$ref": "#/$defs/reason"
        },
        "tier": {
          "enum": [
            "declared",
            "interrogated",
            "observed"
          ]
        },
        "authored_by": {
          "enum": [
            "subject",
            "platform",
            "external",
            "none"
          ]
        },
        "method": {
          "type": "string",
          "minLength": 1
        },
        "note": {
          "type": "string"
        },
        "attestation_ref": {
          "type": "string",
          "minLength": 1
        },
        "window": {
          "$comment": "Optional (DR-169). Present: the value holds only what the collector's observation window saw, so an item a quieter window did not see is not a removal; status is unchanged by it. ignore: item keys that count traffic in the window and are not part of an item's identity. union: boolean item keys that are true if the thing happened at any point in the window, so a key turning true is something newly seen. An empty object marks a window-bounded list whose items need neither.",
          "type": "object",
          "additionalProperties": false,
          "properties": {
            "ignore": {
              "type": "array",
              "uniqueItems": true,
              "items": {
                "type": "string",
                "minLength": 1
              }
            },
            "union": {
              "type": "array",
              "uniqueItems": true,
              "items": {
                "type": "string",
                "minLength": 1
              }
            }
          }
        }
      },
      "allOf": [
        {
          "if": {
            "properties": {
              "status": {
                "const": "ABSENT"
              }
            }
          },
          "then": {
            "required": [
              "method"
            ]
          }
        },
        {
          "if": {
            "properties": {
              "status": {
                "enum": [
                  "BLIND",
                  "FAILED"
                ]
              }
            }
          },
          "then": {
            "required": [
              "reason"
            ]
          }
        },
        {
          "if": {
            "properties": {
              "status": {
                "const": "ANSWERED"
              }
            }
          },
          "then": {
            "not": {
              "required": [
                "reason"
              ]
            }
          }
        },
        {
          "if": {
            "properties": {
              "status": {
                "enum": [
                  "ANSWERED",
                  "PARTIAL",
                  "TEMPLATED"
                ]
              }
            }
          },
          "then": {
            "required": [
              "authored_by"
            ]
          },
          "else": {
            "not": {
              "required": [
                "authored_by"
              ]
            }
          }
        }
      ]
    }
  }
}
