{"bundle_version":2,"bundle_id":"bnd-example0001","host_id":"host-01","sandbox_name":"shared-agents","collected_at":"2026-09-24T00:00:00Z","rule_pack_version":1,"sandbox":{"inputs_attempted":{"runtime":{"attempted":true,"reached":true},"image":{"attempted":true,"reached":true},"manifest":{"attempted":false,"reason":"NO_SOURCE_ACCESS"},"repo":{"attempted":false,"reason":"NOT_FIRST_PARTY"}},"attributes":{"image_digest":{"value":"sha256:abc123","status":"ANSWERED","tier":"observed","authored_by":"platform"}}},"agents":[{"agent_key":"executor","discovery_status":"available","inputs_attempted":{"runtime":{"attempted":true,"reached":true},"image":{"attempted":false,"reason":"NO_SOURCE_ACCESS"},"manifest":{"attempted":true,"reached":true},"repo":{"attempted":false,"reason":"NOT_FIRST_PARTY"}},"attributes":{"model_name":{"value":"gpt","status":"ANSWERED","tier":"observed","authored_by":"platform"}}},{"agent_key":"planner","discovery_status":"not_found","inputs_attempted":{"runtime":{"attempted":false,"reason":"NO_SOURCE_ACCESS"},"image":{"attempted":false,"reason":"NO_SOURCE_ACCESS"},"manifest":{"attempted":false,"reason":"NO_SOURCE_ACCESS"},"repo":{"attempted":false,"reason":"NOT_FIRST_PARTY"}},"attributes":{}}],"attestations":[]}